,song-name,lyrics,release-year,genius-path
103,Wakin on a Pretty Day, wakin' the dawn of day and i gotta think about what i wanna say phone ringing off the shelf i guess it wanted to kill himself wakin' on a pretty day don't know why i ever go away it's hard to explain my love in this daze   you could say i been most all around but honey i ain't goin' nowhere don't worry about a thing it's only dying i live along a straight line nothing always comes to mind to be frank i'm fried but i don't mind yeah yeah yeah yeah yeah yeah yeah  yeah yeah yeah yeah yeah yeah yeah  yeah yeah yeah yeah yeah yeah yeah  yeah yeah yeah yeah yeah yeah yeah   been diggin' layin low low low i'm diggin' layin low low low dig dig in to these lives that we are living in living low lackadaisically so   risin' at the crack of dawn and i gotta think about what wisecracks i'm going to drop along the way today phone ringin' off the shelf i guess somebody had something they really wanted to prove to us today yeah i'm waking on a pretty day floating in place no need sayin nothin' to explain it to my loved ones today ,2013,/Kurt-vile-wakin-on-a-pretty-day-lyrics
104,Was All Talk, spirit in the sky transparent to the eye talking trash on nothing the human eye can see anyway and that's anarchy for you and me when all this work is out of mind  there was a time in my life when they thought i was all talk now i'm feeling stalked by god walking i got the upper hand walking  now take a look at my hands watch me go watch me going yeah i'm going yeah i'm gone  freak in the fog through the dew in the dawn all the words i'm saying are wrong now won't you watch me and yet there was a time in my life when they thought i was all talk  lefthanded smoke shifting from a righthanded man can you sense the snag in my playing  spirit in the ether from a rightwing sister safe to say she don't get out that much  there was a time in my life that is gone that i sometimes still go back to not to be all stalking myself too much well i got the upper hand here in present days   now take a look at my hands watch them go watch me going yeah i'm going yeah i'm gone ,2013,/Kurt-vile-was-all-talk-lyrics
105,Wedding Budz,instrumental,2013,/Kurt-vile-wedding-budz-lyrics
106,Wheelhouse, sometimes i talk too much but i gotta get it out but i dont wanna talk i only wanna listen my baby talks soft my ears are always ringing now humming a sad song when im alone but you gotta be alone to figure things out sometimes be alone when even in a crowd of friends and not so sometimes of whom you just cant distinguish but thank god for the former yeah   some bow down a hundred times a day or more to find a way to get back down to the temple one day find the temple to bask in the glory of roll around on a floor of furry carpet then sleep soundly for the first time in forever and breathing deep inside  theres a desert down below the earths core a hidden staircase in the house that you reside in a little something from the cupboard over there a little medicine its a medication situation   some bow down a hundred times a day or more to find a way to get back down to the temple one day find the temple to bask in the glory of roll around on a floor of furry carpet then sleep soundly for the first time in forever and breathing deep inside,2015,/Kurt-vile-wheelhouse-lyrics
107,White Riffs,instrumental,2009,/Kurt-vile-white-riffs-lyrics
108,Wild Imagination, im looking at you but its only a picture so i take that back but it aint really a picture its just an image on a screen you can imagine if i was though right just like i can imagine you can imagine it cant you i got a wild imagination   give it some time  give ya some time   im laughing out loud so much it appears that im crying babe yes come out on the porch mama ill tell you about my past theres believers and lovers and druggers and dreamers and drunkards and schemers and im afraid that i am feeling much too many feelings simultaneously at such a rapid clip      ,2015,/Kurt-vile-wild-imagination-lyrics
109,Wounded Bird,like a wounded bird trying to fly surrounded by green fern still a cozy and scenic place to die lately i've been flying high then i guess i had to crash always did i love that i love that line but never did i apply it to myself 'til just then  on the corner of our camping site there's an entrance there to the woods watch my kids there as they play while me i'ma just pick away on a red fender palomino guitar for a change  my daddy was a railroad man imagine all the miles of steel he rode along his wholе life long now i just put that in a song my mother she would mеnd our wounds while he was out along the track maybe try and clip our wings well i remember everything like the red feather wingspan of some great majestic bird come flying over the horizon above a field of birds of paradise  or was it real or was it just a dream or was it real or just a dream just a dream whew  like a wounded bird trying to fly surrounded by some trees in a cozy scenic place wish the world would stop and take notice of all the disgrace but then breathe in quite deep and smell all the flowers while in bloom ,2022,/Kurt-vile-wounded-bird-lyrics
110,Yeah Bones,one two three four   when nobody calls you on the phone don't break your bones over it you'll only leave yourself lonesome to show for it when nobody calls you on the phone don't break your bones dyin' dead in a black sea of tears over me   when you're runnin' on the run but you run run too far tomfoolin' and buckwild deep in the country wildcats get shot at when you're runnin' on the run but you run too far where the rednecks raise hell with the shotgun shell blast     when nobody calls me on the phone won't break my bones over it i don't believe myself lonesome to show for that when nobody calls me on the phone won't break my bones dyin' dead in a black sea of tears over me over me over me over me now over me over me over me now over me over me over me now over me over me over me now over me over me over me now over me over me over me now,2018,/Kurt-vile-yeah-bones-lyrics
