,song-name,lyrics,release-year,genius-path
0,Air Bud,strange strange days inside my mind is daily changing and it's charged by the shifting tones of time flying just in case you were wondering where i was was strange strange strange days inside my mind is daily changing as result of the black cloud coming down just in case you were watching the horizon horizon horizon  we want out and we want it now we wanna take it outta town we want out and we want it now we wanna take it outta town strange strange days inside,2013,/Kurt-vile-air-bud-lyrics
1,All in a Daze Work, chinese charms and welltanked in burbank strumming unsuccessfully but moreso just pressin' keys and hey jack of diamonds all jack of horse hey man i believe i'm floating and off course of course guess i got my mind well twisted didnt i well   all in a daze work and all in a daze work and all in a daze work and all in a daze work and all in a daze work and all in a all in a all in a daze work   she come flying through like a traveling gypsy show tornado leaving us lying there bleedin cut wide open hearts broken guess i got my mind well twisted didnt i well  chorus all in a daze work and all in a daze work and all in a daze work and all in a daze work and all in a daze work and all in a all in a all in a daze work,2015,/Kurt-vile-all-in-a-daze-work-lyrics
2,Amplifier,don't just stand  your head don't sit   turn around to the trees toss your key 'cause this is home this is home  alone  the  that you got to know i don't mean to cause you suffering  'cause i got nothing in my head  to tell a  he was alone he was alone don't sit still head don't sit   upside down turn around towards the amplifier  understand my command free your keys 'cause this is home this is home this is home home home,2009,/Kurt-vile-amplifier-lyrics
3,Baby’s Arms,there has been but one true love in my babys arms in my babys arms and i got the hands to hold onto them  i get sick of just about everyone and i hide in my babys arms my babys arms 'cause except for her you know as i've implied  i will never ever ever be alone 'cause its all in my babys hands shiny shiny secret stones in my babys hands in my babys hands  i get sick of just about everyone and i hide in my babys arms shrink myself just like a tom thumb and i hide in my babys hands hide in my babys hands  'cause except for her there just ain't nothing to latch onto yeah yeah yeah  there has been but one true love in my babys arms in my babys arms in my babys arms in my babys arms in my babys arms in my babys arms in my babys arms,2011,/Kurt-vile-babys-arms-lyrics
4,Bad Omens,instrumental,2015,/Kurt-vile-bad-omens-lyrics
5,Bassackwards, what's in realwhat's in real time ha ha ha   i was on the beach but i was thinking about the bay got to the bay but by then i was far away i was on the ground but looking straight into the sun but the sun went down and i couldn't find another one for awhile for because it was an allburning feeling in my chest to fill the void of a long night unwatched by well the sun until the morn until when well the sun's reborn and so am i from all the scorn buried deep within the psyche of my soul i was standing down but i was also on the run in my mind  i was on the radio talking with a friend of mine there wasn't no format because well we like it like that he was out of his mind and i was way out of mine then everything went backwards with words coming out bassackwards and i appreciate him to the utmost degree ,2018,/Kurt-vile-bassackwards-lyrics
6,Beach On The Moon (Recycled Lyrics),i got a freeway in mind let go of my head walk down my line better be sure you'll be dead you get up on top these days you gotta be a lowlife drifter so slither up just like a snake upon a spiral staircase  got a freeway in mind let go of my head walk down my line better be sure you'll be dead you get up on top these days you gotta be a lowlife drifter so slither up just like a snake upon a spiral staircase slither up just like a snake upon a spiral staircase  get your damn hands off of my land why don't you sock me and get off of my street 'cause i scared you out of your own shoes now i'm gonna tie 'em together and hang 'em on a wire till it's junkies for hire and i got a hunchback  got a freeway in mind let go of my head walk down my line better be sure you'll be dead to get up on top these days you gotta be a lowlife drifter so slither up just like a snake upon a spiral staircase slither up just like a snake upon a spiral staircase slither up just like a snake upon a spiral staircase slither up just like a snake upon a spiral staircase slither up just like a snake upon a spiral staircase slither up just like a snake upon a spiral staircase slither up just like a snake upon a spiral staircase slither up just like a snake upon a spiral staircase slither up just like a snake upon a spiral staircase,2009,/Kurt-vile-beach-on-the-moon-recycled-lyrics-lyrics
7,Blackberry Song, man i like your style make it last a little while put yourself under the ground and you come back around i want to see you still the same   girl you're like a child your blackberries grow so wild pick the best ones off the bush you relish and wish you were alright left with lace with rightness   my beloved blackberry my love for you floats free leave yourself in sound turn around sing me your blackberry song,2009,/Kurt-vile-blackberry-song-lyrics
8,(Bottle Back),instrumental,2018,/Kurt-vile-bottle-back-lyrics
9,Bottle It In,don't tell them that you love them for your own sake naw you better bottle it in  don't tell them that you love them for your own sake 'cause you never know 'cause you never know when your heart's gonna break and that's a chance we just can't take  you bottled it in you bottled it in  you never got back at me when when i most needed it i would say i didn't mind but you done it over and over all the time all the time you better bottle it in  don't tell them that you love them for your own sake 'cause you never know when your heart's gonna break and that's a chance you can't take don't don't don't don't dammit ,2018,/Kurt-vile-bottle-it-in-lyrics
10,Box of Rain,look out of any window any morning any evening any day maybe the sun is shining birds are winging no rain is falling from a heavy sky what do you want me to do to do for you to see you through for this is all a dream we dreamed one afternoon long ago  walk out of any doorway feel your way feel your way like the day before maybe you'll find direction around some corner where it's been waiting to meet you what do you want me to do to watch for you while you're sleeping then please don't be surprised when you find me dreaming too    look into any eyes you find by you you can see clear to another day maybe been seen before through other eyes on other days while going home what do you want me to do to do for you to see you through it's all a dream we dreamed one afternoon long ago  walk into splintered sunlight inch your way through dead dreams to another land maybe you're tired and broken your tongue is twisted with words half spoken and thoughts unclear  what do you want me to do to do for you to see you through a box of rain will ease the pain and love will see you through ,2016,/Kurt-vile-box-of-rain-lyrics
11,Can’t Come,to come through for you must first include me too and i can't come through for me no i can't come through for oh my honey child stole my money clout no i can't come through for it no i can't come through for shit's creek calls and damned if i did answer and if i did that ain't true i can't come through for you  the words we share with our human heads we spend all day filing it well thats one big pile of shit life was fun until i met someone then four then three then two so what's it gotta do with you when i was young i had everyone then three then two then one could there never be no one oh my honey child stole my money clout no i can't come through with it no i can't get through with it,2009,/Kurt-vile-cant-come-lyrics
12,Chazzy Don’t Mind, strummin a song that teapot wants to sing along but i dont mind no i dont mind   write about what you see around you children and flowers and days for hours songs for miles and i dont mind no i dont mind i dont mind i dont mind  my girlfriends chazzybelt they got a song like this too prolly but i dont mind no i dont mind i dont i dont mind   my mind is hummin when i walk im dreamin riding skateboards downhill   smooth hiss of brand new blacktop swells all just from well im really just lookin outside from inside leanin on my windowsill   strummin a song that teapot sings in a beautiful falsetto and i dont mind i dont mind oh i dont mind oh i dont mind,2022,/Kurt-vile-chazzy-dont-mind-lyrics
13,Check Baby,check baby check baby one two three thats alright with me singing playing all the time now hey look lucky me always been in touch with reality you see  ahh check old man check old man check all the cables and the chain yeah check baby check baby one two three its alright with me amphetamine amphetamine you know what i mean she got a real kick to her yeah balls to the balls to the balls to the walls to the walls watch the man watch the man watch him as he walking around the world yeah it's balls to the walls to the walls to the walls to the walls  check baby check baby one two three that's alright with me hey hey look look at me always been in touch with the world obviously yeah check baby check baby three four five never no jive talking turkey not me and check old man check old man check all the cables and the chain and get back at me get back at me when its safe to sling up my sixstring then it's easy like four five six anybody got a pick  check baby check baby all day 'round i was very lost but now i'm way unfound check brother check brother check what a world weve inherited from another mother what a whale of a pickle what a spell we are all pinned under we give the devil a warm embrace and then we run like chickens from the dickens but you wanna go to heaven when you die that's alright with me its easy like four five six anybody got a pick alright yeah check it old man ,2018,/Kurt-vile-check-baby-lyrics
14,Cold Was the Wind,cold was the wind on my frozen face but i didn't mind cause i was long gone  cold was the wind upon my brow below that well you don't wanna know at all cold was the wind yeah  christmas in siberia with the little bitty case of the delirium tremens for some reason picture roger clemens but mike schmidt's more of the city i came with crossed my heart hoped to die stick a needle in my butter around your bread  cold was the wind on my naked brow below it well you don't wanna know at all cold wind blows  cold wind blows on my naked brow sun sits down on the sacred cow you better goddamn miss me when i'm gone 'cause god's gonna damn me up and down now wherever it is they're gonna give me the business whoever it is gonna miss my girls on the plane i'm drinkin red wine 'cause like everybody else i'm afraid to die did i mention that i'm afraid of dying think i heard my daughter crying so i pick her on up spin her around live it on up of what i found ,2018,/Kurt-vile-cold-was-the-wind-lyrics
15,Come Again, autumn come and winter gone then spring came all over the lawn i wanna die then be reborn like seasons come and go and come again   come again come again what was that you said come again come again cccome on down the world had better come around  i feel it in my chest i feel it in my soul the music and the whiskey and it's warm and nurturing in a weird way i feel it in my face right now when i sing and it makes me wanna cry and scream and cry and   come again come again what was that you said come again come again cccome on down could use a little help comin' around   autumn come and winter go then spring sprayed all over all we know then summer come in raging brought my blood right to a boil but even the heat too turned around and went but it was a long one   come again come again what was that you said come again come again cccome on down the world had better come around come again come again come again yeah come again,2018,/Kurt-vile-come-again-lyrics
16,Cool Water, hey where you goin now are you goin home where is that at baby i i been thinkin i been drinkin i been dyin and craving some   cool water cool water just like hank sang hank sang   wait wait your turn and do ya got something to burn cause now now is the time to smoke em if you got em but when when youre done bite your tongue and put out the cherry with some   cool water cool water just like hank sang hank sang ,2022,/Kurt-vile-cool-water-lyrics
17,Dandelions,dandelions for my girls  i ain't lyin just bein' a little exotic you can blow on 'em or you can just hold em i ain't mindin' even when you're cryin' any which way you wanna go with 'em  i like the feeling of being sentimental and also a little mental i don't mind crying but i prefer them be tears of joy over rage anything over rage anything over mind and everything over age i'm over that when i look back at my  dandelions for my three girls dandelions for my three girls ,2020,/Kurt-vile-dandelions-lyrics
18,Dead Alive,you're telling me a good man is hard to find well what are you blind well never mind let's try and have a good time there was a war of independence if a man's a hindrance well you know where you've got a right to go  better take a breather till you're better till you're breathing till you stop sweating better take a breather till you stop sweating and knit me a sweater  you're telling me a good man is hard to find what was that you better rewind 'cause it's me mama i'm showing everybody a good time you're always looking for a few good men well here's one baby won't get wasted on a gun  better take a breather till you're better till you're breathing till you stop sweating better take a breather till you stop sweating and knit me a sweater  call me old dog when i'm gone but when i'm back it's always old man where you been so long where you been so long where you been so long ,2009,/Kurt-vile-dead-alive-lyrics
19,Doctor Orgatron,instrumental,2009,/Kurt-vile-doctor-orgatron-lyrics
20,Dust Bunnies,you may think that it's funny now that i got a headache like a shop vac coughin' dust bunnies it's hard to see when it's all red and all you hear are just white noises this little one she's a delicate creature no safety features to hold her down girl you've been runnin' on all cylinders pull in the yard and cut it hard  but no they won't find us lying down on the ground and it ain't at the bar where i am or you are we'll take a puff on a cigarette see what we get an invigorating fix and a black lung  don't know much about history and don't know much about the shape i'm in there ain't no manual to our minds we're always lookin' baby all the time  but no we won't find it rollin' around on the ground and it ain't at the bar where i am where you are i took a puff on the cigarette saw what i get an invigorating fix and a black lung  you think you're tired put your face in my place we swap faces and i see you're tired it's hard to think with a squashed brain and let's hope that don't leave a permanent stain how can you talk over all that racket what's there to feel but totally whacked ,2015,/Kurt-vile-dust-bunnies-lyrics
21,Feel My Pain, feel my pain and ill do yours were all banged up but whos keepin' score well im not are you theres a place out there that we can go and clean up our act in then come out squeaky clean so no one will know where we been   how can i sing to em straight from my heart babe its all i ever really wanted to do anyway from the start babe hear what im sayin' and feel my pain if thats alright for you   theres a fountain out there flowin' deep and wide somewhere deep in this town to jump in if you can swim and i never did much talkin' anyway ok thats a lie but that dont matter to you feel my pain and come inside or stay the course with a bulldozing force riding on a demonpossessed horse theres a place out there people go and never come back if youd care to say your prayers ,2013,/Kurt-vile-feel-my-pain-lyrics
22,Flyin (like a fast train), flyin' like a fast train i don't feel a thing 'til when pull into my station just crash and burn yeah playin' in the music room in my underwear feelin' fine and then my psyche crumble pell mell stumble i been bamboozled better watch out we got vampires lurkin'   flyin' like a fast train i don't feel a thing 'til when i pull into my station i just crash and burn oh oh yeah oh oh  flyin' acid flashback flyin' saucers black coffee pink lemonade from the faucet seein' dragons but they're so pretty baby come on let's go tear up the city naw think we better slow it down ooh ooh ooh ooh la la la   flyin' like a fast train i don't feel a thing 'til when i pull into my station i just crash and burn oh   cooped up creature of discomfort can't touch a thing so i take a walk 'round thе block then i come back and sing say what's wearing you down kid wеll try a little lot of everything   flyin' like a fast train i don't feel a thing 'til when i pull into my station i just crash and burn   yeah yeah mmm mmm mmm mmm mmm mmm mmm mmm mmm mmm mmm mmm mmm mmm mmm mmm ,2022,/Kurt-vile-flyin-like-a-fast-train-lyrics
23,Fo Sho, even if im wrong even if im wrong gonna singamy song til the break of dawn like woo   but even cause im real even cause im real even cause im real gonna peal another smash poem out a yellow legal pad for ya baby while i can   even if its sike cause i know that im right and i been doin this a long time since before i was born   and its prolly gonna be another prolly gonna be another long song prolly gonna be another long song   ,2022,/Kurt-vile-fo-sho-lyrics
24,Freak Train,go ahead tell me hello or fuck you whatever introduction suits you i ain't trying to fight i'm just trying to ride this train and make it home tonight  hey i don't care if you care or if you're trying to break my nose or just stand around stare me down and cough where the hell do you get off anyway freak train  well there's people out there who tell you lies they get off on giving wrong directions well fabrication's my best friend but i ain't never been so insulted in my whole life  riding on the freak train train train train riding on the freak train train train train riding on the freak train train train train riding on the freak train yeah well there's a whole new story there well there's a whole new story there well there's a whole new story there  let it hang out like you just don't care and drag it everywhere whoo  one day i'm going to get enough dough to get me where i want to go comfortably they say acela rides a little faster but for now it's freaks and how and whoa get off me cause a man with hands for every finger claiming he's a folk singer and he's raring to bite his nails think i'd rather ride the rails ,2009,/Kurt-vile-freak-train-lyrics
25,Frip Job,instrumental,2009,/Kurt-vile-frip-job-lyrics
26,Ghost Town,in the morning i'm not done sleepin' in the evening i guess i'm alive but that's alright i can still peel myself up sleepwalking in a ghost town think i'll never leave my couch again 'cause when i'm out i'm on it in my mind then again i guess it ain't always that way  in the morning i'm not done sleepin' in the evening i guess i'm alive that's alright i can still peel myself up sleepwalking in a ghost town think i'll never leave my couch again 'cause when i'm out i'm on it in my mind christ was born i was there you know me i'm around i got friends hey wait where was i well i am tryin'  when i'm drivin' i find i'm dreamin' jamming tunes and drifting and it's just then sometimes i wanna pull over open up and stay and uh raindrops might fall on my head sometimes but i won't pay 'em any mind  christ was here you just missed him now i'm out going down second to all the stores to see my friends to find kinks vinyls yeah  and when i'm drinking i get to jokin' then i'm laughin' fallin' down but that's just fine and i just pick myself up and walk down ghost town raindrops might fall on my head sometimes but i don't pay 'em any mind then again i guess it ain't always that way,2011,/Kurt-vile-ghost-town-lyrics
27,Girl Called Alex, in the dawn's early light i recall a girl named alex she and mark they were happily wed hey at least in my head   i think about them all the time i think about them all the time i think about them all the time i think about them all the time   i wanna live all the time in my fantasy infinity there i will never be abandoned there i'll ever handle against everything from ever happening to them   and they hate it when i say i wanna   i wanna walk out into the night without it being running away from a bad day in my brain for the sake of a strip that i could be cruising in the comfort of a sportscar illusion ,2013,/Kurt-vile-girl-called-alex-lyrics
28,God Is Saying This To You,instrumental,2009,/Kurt-vile-god-is-saying-this-to-you-lyrics
29,Goin On A Plane Today, going on a plane today gonna chug a beer and curse my name see you on the other side either on the tarmac or the after life   things getting a little weird my mind gone foggy my memory's unclear manhood compromised watch me shrinking back into a little kid just as i'm just getting old  going on a plane today listening' to heart of gold gonna open up for neil young man life can sure be fun imagine if i knew this when i was young too   as well,2022,/Kurt-vile-goin-on-a-plane-today-lyrics
30,Goldtone,sometimes when i get in my zone you'd think i was stoned but i never as they say touched the stuff i might be adrift but i'm still alert concentrate my hurt into a gold tone golden tones  in the night when all hibernate i stay awake searching the deep dark depths of my soul tone golden tones gold tones there's a place in my heart for all of my friends some have stepped out but some check back in been livin' my life on the run from day one every day is hey so are they  but if i been lookin' back today looking back in gold tones  yeah yeah  in the night when all hibernate i stay awake searching the deep dark depths of my soul tone golden tones  yeah yeah  i been all around been up and down this round world that is always turning til some day or so they say when ahey hey i wanna hear a gold tone  sometimes as i'm floating away i wish i could stay then i arrive among the dropping flies there's a place in my heart been trying to locate it's somewhere within and it's for all them with its gold tones ,2013,/Kurt-vile-goldtone-lyrics
31,Gone Girl, she is deliciously tall sort of a long girl she is delightfully small sort of a song girl  she freely admits to the world that she was a wrong girl that's nothing compared to the fact that she is a gone girl   gone like a knock on the door gone with yesterday and before gone with the wind forevermore   she never lay claim to the fact that she was a strong girl so why should i loudly proclaim that she was a wrong girl  i'd rather think of her name as some sort of song girl and think poetical things to think of my gone girl ,2020,/Kurt-vile-gone-girl-lyrics
32,Heart Attack,you're gonna give me a heart attack you're gonna get all the   you better get your head really screwed on you better get your head really screwed on  you're gonna give me a heart attack you're gonna get all the   you better get your head really screwed on you better get your head really screwed on  you're gonna turn the white man black you're gonna turn all the brown man back you take the spotless soul of a man you take the cracks for anyone who would understand  you're gonna give me a heart attack you're gonna get all the   you better get your head really screwed on you better get your head really screwed on  you've always been the  you're  when the code is resolved you're gonna give me a heart attack we're gonna lose time  ,2009,/Kurt-vile-heart-attack-lyrics
33,He’s Alright (Bonus Track),way over there where the wind come from i swear i thought i was the only one each time i stop to get air well i'm still over there  the silhouette kid's swinging on a swing scrapes his knee and blood it brings he shows his friends he's alive as he brags and he jives hey he's alright yeah  they say makin up for lost time ain't makin up for much at all sometimes i think gettin old is oh so last year yeah  but other times i grab the bull by the horns rip em off with calloused hands sometimes you cry like a child still get up in the mornin i was a geezer just last night watchin tv and not understandin anything i scrape my face on the clouds every time i get out but that's day time  some people they use up all their cash records and such just sit around but i don't care about that people say i'm to blame i guess i think it's a shame oh but i don't care yeah,2009,/Kurt-vile-hes-alright-bonus-track-lyrics
